1,SARAH KOENIG,Chapter VI.
100,BRIAN REED,"He went into his backyard and pounded the ground to let out his frustration with John. Olin saw parts of himself in both the movie's characters, Heath Ledger's character's fear of the world knowing he was gay, but also the way Jake Gyllenhaal's character could feel so hurt by that fear. And he really thought John would get a lot from it, too."
101,OLIN LONG,"I wanted him to relate to that. I wanted him to relate to it, and he didn't at first. But then, over time, we talked again. And I talked about it more, and I talked about it more. And then he began to be interested in hearing more of it. So I said, what is your address?"
102,BRIAN REED,"John didn't have a TV or go to the movies, so Olin ordered him a copy of the original short story."
103,OLIN LONG,"I did. I ordered a copy, and I had it sent to John. That was the second time I heard John cry, because he read it. He read Brokeback Mountain."
104,BRIAN REED,"He read about Jack Twist and Ennis Delmar, their secret trysts after falling for each other on the mountain with their wives and children at home. And how despite Jack's pleas to Ennis to just get a ranch with him and have a real relationship—never do that. Because Ennis insists, I'm stuck with what I got, caught in my own loop, can't get out of it. And who go on like that for years—Jack desperate to break out of the loop and Ennis too afraid. Until one day Ennis sends Jack a postcard, and it comes back with a stamp saying deceased."
105,OLIN LONG,"We were on the phone, and he was crying about it. He had read it. And after that, he always referred to it as the grief manual. He said, I took down the grief manual and read it again tonight."
106,BRIAN REED,"And so this is what Olin and John's relationship eventually settled into. They were confidants and close friends, supporting each other through this experience they were both living, of being middle-aged and gay in Alabama, and alone, John giving once in a while hints that maybe he wanted their relationship to be something more."
107,OLIN LONG,I want to ask you a question if I may.
108,BRIAN REED,Please.
109,OLIN LONG,"How did he take his life, and what were the circumstances?"
110,BRIAN REED,"I tell Olin how John did it. He had assumed, based on conversations with John, that it was a gunshot to the head."
111,OLIN LONG,He drank cyanide.
112,BRIAN REED,He drank cyanide.
113,OLIN LONG,"Um. OK. Yeah. Well, that's surprising that it was cyanide."
114,BRIAN REED,I'm sorry.
115,OLIN LONG,"Poor—no, that's all right."
116,BRIAN REED,I'm sorry.
117,OLIN LONG,"That's all right. That's all right. I was thinking that, you know, this—I just need to know. And I'll work through this. This is poor John. John."
118,BRIAN REED,Yeah.
119,OLIN LONG,John.
120,BRIAN REED,What led to John and Olin's not speaking during the last couple of years of John's life was a growing preoccupation with several subjects that Olin says John would not stop ranting to him about.
121,OLIN LONG,I heard a lot about climate change.
122,BRIAN REED,"Also the economy. Olin was a good friend. He would listen to John and actually engage with him on these topics. John would refer to certain books a lot, and Olin actually went and read several of them— Going Dark and Walking Away from Empire by Guy McPherson, and Al Gore's book, An Inconvenient Truth. He told John, I believe in climate change. I think it's an issue. I try to do my part. I switched over to energy-saving light bulbs. I don't know what else we can do besides have everybody do their part."
123,OLIN LONG,Then there was mostly Shittown. That was mostly it.
124,BRIAN REED,"And these tirades bothered Olin the most, because Olin felt, compared to climate change and oil and the economy, this was something John could actually do something about. John would go on and on about the miseries of Shittown, and Olin would tell him again and again, if it's really that bad, you can leave. You have the means. You can leave. And John would say, I know. I want to leave. And then the next time, on the phone from his kitchen, he'd be howling about Shittown again."
125,OLIN LONG,"And I just couldn't hear any more of it. I couldn't hear Shittown, Shittown. I couldn't hear it anymore. If you're not going—if you don't like it, leave it. You can leave it. You can leave it."
126,BRIAN REED,"After one such conversation in September 2013, having heard it for the umpteenth time, Olin hung up the phone."
127,OLIN LONG,And he sent me an email within a couple of days that was extremely profane.
128,BRIAN REED,"John had witnessed an incident at the Green Pond Grocery near his house that had set him off. Olin thinks it had something to do with how a father had disciplined his young son there in public, but Olin says John also made some indirect jabs at things Olin had expressed in their previous conversation. It wasn't a humorous message, he says. It was angry. And Olin felt at the end of his rope. So he responded and wrote simply, John, please don't send me any more of these profane emails. And John replied with another profane email back."
129,OLIN LONG,"—the doctor. And that may have been why he put on a clean, navy blue shirt, which I thought really enhanced that red hair. And he was wearing a pair of pants. I don't know if they were jeans, made out of denim jean material, but they hugged his thighs and such and his belly. And I just remember I just wanted to lean over there and do some stuff, because I'm sitting there in a truck with John B. McLemore outside a doctor's office picking up my azaleas, I knew exactly what I wanted to do. I knew exactly what I wanted to do. I wanted to reach over there. I wanted to pull his shirt up, expose his belly, and just kiss all over his belly around that red hair, just to that extent. And I wanted to do it slowly and sensuously. That's what I wanted to do and see what he thought about it. He's doing nothing but sitting there under the steering wheel of an F-150 pickup truck. But it was just the whole aura. It was the hair, the skin, the intelligence, the—he was in a jolly mood that day."
130,BRIAN REED,"And yet, instead of doing anything—"
131,OLIN LONG,"I kept those feelings to myself. I think now, if I could go back, if I could get in a time machine and go back there and relive that moment, I would at least speak up and tell him what I was thinking. I'd probably look over there and say, John, I don't know how you're going to feel about this, but I really want to kiss you right now. There. I've put it out there. That's what I want."
132,BRIAN REED," F-150 pickup truck love, denim hugging on your thighs love, azalea love, doctor's parking lot love, kissing on your belly and all around your red hair love. Too bad that didn't actually happen, because that's something you could write a country song about. "
