1,SARAH KOENIG,Chapter VI.
2,BRIAN REED,"From Serial and This American Life, I'm Brian Reed. This is Shittown."
3,JOHN B. McLEMORE,"Phew. Stinking old car. Aw, man. Time to get another one."
4,BRIAN REED,"After a long day running around Bibb County together, to the courthouse and the library, and past the Burt family compound just to have a look at it, John and I are driving in his beat-up Mercedes back to his place. It's my last night here. I'm flying home tomorrow. John wants to swing by the Little Caesars to pick up a pizza for his mother. It's getting dark."
5,JOHN B. McLEMORE,"OK. We're going to take the shortcut through here, since the sun's diminishing arc is passing beneath the horizon. As the sun's diminishing arc passed beneath the horizon."
6,BRIAN REED,"A rare moment of quiet with John, in the dusk."
7,JOHN B. McLEMORE,Phew. I'm gonna miss ya. I hate to tell you that.
8,BRIAN REED,"I'm going to miss you, too."
9,JOHN B. McLEMORE,Shoot.
10,BRIAN REED,Hopefully I can get back down here.
11,JOHN B. McLEMORE,At least come down here once every now and then for a lecture on climate change and energy.
12,BRIAN REED,[LAUGHING]
13,JOHN B. McLEMORE,And the impossibility of paying our debts. [DOOR CHIMING]
14,MAN,I'm low on deep dish!
15,BRIAN REED,"John grabs a pepperoni pizza from the Little Caesars to bring home to Mary Grace. And as we're climbing back into the car in the parking lot, a very minor confrontation occurs. A manager emerges from the pizza place and says to me, were you recording in my store? I tell him, yeah, I was recording John. He says, there's no recording allowed. That's all right, I say. We're leaving anyway. We won't come back. Sorry."
16,MAN,That's all right. It's just so you know.
17,BRIAN REED,"That's it. The guy was fine to me. This was not a big deal. But as we drive away, John will not let it go."
18,JOHN B. McLEMORE,"My store, my store, oh, I love it. Oh, my store. That motherfucker. He doesn't own a pot to piss in or a litter to sling it at. He probably lives over at South Forty."
19,BRIAN REED,"South Forty trailer park, where Tyler lived at one point, across the street from John."
20,JOHN B. McLEMORE,"He thinks he's a top dog. He runs the Little Caesars in Buttfucksville, Alabama. In my store—is you recording anything in my store? (LAUGHING)"
21,BRIAN REED,"Like, I'm over this. But then John busts out this lovely word."
22,JOHN B. McLEMORE,"He's probably a fag, too. They always overcompensate. You know, I've been on both sides of the fence, so I know the psychology of heterosexual and homosexual. That's probably the type that likes to overcompensate. They call themselves tops. You know, they shout down the bottom. That's usually how that type of relationship works."
23,BRIAN REED,"John talking like this—it did make me wonder. This is going to sound like a ridiculous question, but is there a gay scene down here?"
24,JOHN B. McLEMORE,"Oh, my god. There's no telling how many closet cases are in this town. You turn that off, and I'll tell you something."
25,BRIAN REED,OK.
26,JOHN B. McLEMORE,Hit the kill button for a second.
27,BRIAN REED,"This is one of the few times John ever asked me to turn my recorder off. What that usually means is that I wouldn't tell you what he said without getting his permission to describe it. But there are a few reasons I am going to give you an overview of what he told me in the car that day. First, since John died, two other people who knew him well have told me the same information on the record. Also, John was very clear that he did not believe in God or an afterlife. So John, in his own view, is worm dirt now, unaffected by this. And lastly, what John disclosed, and where it led me after he died, helped me understand him so much more. And I think trying to understand another person is a worthwhile thing to do. So what he told me was about a local man with whom he'd had a sexual relationship not all that long ago. I'm not going to say exactly who the man was, because that's the part John wanted secret. It wasn't the fact that he had been with men that he didn't want recorded, but that he had been with this particular guy. Because John had talked to me about this guy already, multiple times, and told me that he was not a good person. The guy worked on John's yard over the years. And for a while, they'd been close. After John committed suicide, I went to meet with the man. We did an interview on the record, but I'm not going to use the recording. He's friendly when I arrive and open to talking. We sit, and periodically as we speak, his wife wanders by and eavesdrops. He says his relationship with John was close but a working one. John would pay him to do projects on the house and yard, which John did with lots of people. And the man says that over time John became overly attached to him. John didn't like for the man to leave or when he had other commitments. At a moment when his wife isn't around, I ask the guy if his and John's relationship was romantic, if it was sexual. I think that's what he wanted, the man says. I think he just wanted a partner. Not so much sex, I guess. I hope not. Had me scared, though. And so it wasn't ever sexual with you guys, I ask. Mm-mm, he says. 'Cause he said otherwise, I tell him. The man snaps his head towards me with big eyes. Mm, he says. I tell him he doesn't need to talk about it if he doesn't want, but because John told me about it, I felt compelled to ask. Mm, he says again. He pauses. Mm-mm. And that is all that is said on the matter, though there is one moment later in the conversation when the man is telling me about the reason he and John started spending less time together. The man had started dating a woman, and John would say harsh things about her. He says he knew what John was trying to do—he was trying to get the man to be with him instead. But that ain't what I wanted, the man tells me. I don't want no boyfriend. I want a girlfriend. I'm straight and gonna stay that way, too. I left my visit with that man, more than a year after John killed himself, feeling lots of things, but mostly feeling like, ugh, is that what passed for love in John's life? This guy maybe who has a wife and doesn't acknowledge their relationship, and who John thinks is an asshole, anyway? John did have Tyler, I guess, and Michael Fuller, years back, both of whom he clearly cared about, but both of whom were in very unstable situations and, oh yeah, were also straight. Tyler says he and John would tell each other, I love you, man, of course with the requisite caveat that they weren't trying to get up each other's butts. But that's not love, like love love, the kind of love I hear about all the time on the country music stations as I'm driving around west Alabama. [MUSIC - ""LOVE YOU LIKE THAT"" BY CANAAN SMITH] Did John ever have love in his life? Not ""I really feel something for this kid Tyler"" love, but Mississippi River love, fifth of whiskey love, muscadine wine, Tom Petty track, all night till the sun come back love. Or even a quieter, steadier, maybe even longer love. Did John ever have a relationship resembling any of that, or did he spend the entirety of a lifetime without it? One night in October 2015, as I was getting married, actually, an email showed up in my inbox. No, I was not checking my email during my wedding. I noticed it the following week. Hello, sir, it began. My name is Olin Long and I was a friend of John B McLemore for 12 years. I recently learned of his death. Olin Long. I'd never heard that name before, and it was not on John's contact list that he left behind after his suicide. Olin goes on to explain in his email that he had corresponded with a friend of John's who was on the list, whom I'd spoken to, and that man told Olin about me, that I was doing a story about John. Can you let me know when this segment will air, Olin writes, I would very much like to listen. Also, I need to know the radio station number, AM or FM. Thank you. I write back and tell Olin it's nice to hear from him, albeit under unfortunate circumstances. I've been talking to all sorts of friends of John's, I explain, learning about him. Would he be open to speaking to me sometime? He agrees. He tells me he lives in Birmingham about 40 miles from John's place in Woodstock. He prefers not to meet at his house, so a few months later I rent a motel room and set it up as a makeshift recording studio. Waiting in the lobby, I see a man walk in, peering around. He's fit, but not skinny, neatly dressed in a well-fitting red sweatshirt and jeans. It's Olin. We shake hands and head into the room. Welcome to the digs."
28,OLIN LONG,The recording studio.
29,BRIAN REED,Yeah.
30,OLIN LONG,All right.
31,BRIAN REED,"Later, when we get to know each other, Olin will ask me how old I think he is, and I will guess John's age, about 50, maybe even younger. But he tells me he's about to turn 60. The years haven't shown in him the way they do in others. He sits with good posture. Military posture, I learn, when I ask him to talk about himself so I can check the levels of the mic. Let me get a quick level on your voice. He was a linguist in the Air Force, with top-secret security clearance, specializing in German and Russian."
32,OLIN LONG,What I did was just listen to Russian pilots talk and send it to the National Security Agency.
33,BRIAN REED,"These days, he's a registered nurse at a nearby hospital."
34,OLIN LONG,I work in the Surgical Intensive Care Unit there.
35,BRIAN REED,"Oh, really?"
36,OLIN LONG,Yeah. Are you getting a good reading here?
37,BRIAN REED,"It sounds great. And also, I'm learning about you, which is helpful, because I have no idea who you are. (LAUGHING)"
38,OLIN LONG,"Oh, gosh."
39,BRIAN REED,So we're rolling.
40,OLIN LONG,How did you know John? I figure you must have met him.
41,BRIAN REED,"I begin to explain how John wrote to our radio show, how he and I spoke on the phone for months before I ever went down there. And before I can get into much more of the story, Olin takes over the conversation. He seems eager to talk."
42,BRIAN REED,"Olin doesn't tell me why he hadn't heard from John in a year. Maybe I'm getting ahead of myself, he says. One day, after all that time not speaking, Olin says he wondered about John, and finally called him, but his phone number was disconnected, which Olin thought was strange, because John's family had had that phone line since the 1960s. So during some downtime at work, he typed John B. McLemore obituary into Google, and there it was."
43,OLIN LONG,"And that's all I had to go on. Because in all the years I knew John, we had no friends in common. I had no one who knew him. So there was no one I could call."
44,BRIAN REED,"Olin says in the more than six months since that happened, he's been grieving alone. He has one friend at work he's told about John. He's been writing about John in his journal. And one afternoon, he visited his grave. And he corresponded with another commenter who left a message on the condolence website, who's the friend of John's who told Olin about me."
45,OLIN LONG,"And it said contact me, so I clicked—"
46,BRIAN REED,"Olin and I will end up sitting in this motel room for five hours tonight, and more than six hours tomorrow, talking about John. He tells me that it feels exhilarating to finally talk about his relationship with John, to try to make sense of it, now that John's gone, with someone else who knew him, too. The singles line Olin and John met on was called MegaPhone. This was in 2003, before online dating became ubiquitous. It was essentially Grindr for your landline. You'd dial into the service, listen to short messages people had recorded describing themselves. If you liked them, you'd beep them, as it was called. And then if they were intrigued, they could pay to be connected with you on the phone. That's what happened with Olin and John. John beeped Olin, and Olin called him back."
47,OLIN LONG,"One of the first things he said to me was that he lived with his parents, and he lived in a small town. And he said, I hope that's not a problem. We just started talking."
48,BRIAN REED,"And that talking went on for months—15 months, as Olin said—before they met in person, usually talking in the middle of the night, because Olin keeps night shift hours even on his days off, and John would just be finishing up his work in the clock shop, which he did in the evening because it was cooler."
49,OLIN LONG,"And I just remember enjoying talking at night, maybe even sitting in the dark with no lights on, and just talking on the phone with John."
50,BRIAN REED,"They found a lot to discuss. Books they were reading. Olin gravitated more to fiction, John to science. They talked about music, things going on in the world, about growing up, and a lot about being gay men in Alabama. Olin didn't still live in his hometown like John, but was born and raised in Alabama, too, and had lived much of his life there. I have to say, Olin has such a ridiculous recall for the details of these conversations, he could be John's official biographer, like what he remembers about John's father."
51,OLIN LONG,"Tom McLemore had one eye that was straight, and the other one was a little off-center."
52,BRIAN REED,Who Olin recalls only from a photograph he saw hanging on John's wall. He never met the man. Or John's mother—
53,OLIN LONG,"Mary Grace's birthday is November the 29th or November the 30th, 1926."
54,BRIAN REED,Who remembers that about their friend's mother?
55,OLIN LONG,She got married in 1951.
56,BRIAN REED,"Oh, yeah. Of course. What about cousin Jimmy on John's father's side? Of course, as Olin and John were chatting, they were feeling each other out. At one point, before they'd met, John sent Olin a photo of himself standing on a chair alongside a very tall grandfather clock at his house, with the ostensible reason of showing Olin how large the clock was. Olin looked at the clock, then looked at the man standing next to it. He noticed John's red hair, his lack of freckles, and thought, he's not bad-looking. When finally Olin visited John in Woodstock, he did so with curiosity."
57,OLIN LONG,"I was trying to decide if I was attracted to him. Because I'm going to be honest with you, when I would go down there and visit him, the few times I'd go down there, it was to take a second look."
58,BRIAN REED,"Though if they were trying to impress each other, John didn't necessarily put in a ton of effort."
59,OLIN LONG,"I mean, I went over there dressed like this one time, and he said, I only dress that way to go talk to the lawyer."
60,BRIAN REED,"I mean, Olin was dressed in that he was wearing jeans and a shirt."
61,OLIN LONG,"The difference is mine were clean and untattered. He was wearing a t-shirt with holes in it, paint stains all over it. And the trousers he had on, very much the same. And then, of course, I was down there one evening in his bedroom, and he had a pile of handkerchiefs there on the floor. And I suspected they were used handkerchiefs. And surely enough, he had to blow his nose, and he went over there and he picked up a used, wadded-up handkerchief and blew it, and then threw it back down there in the pile. And I didn't say anything, but I thought, I don't do that."
62,BRIAN REED,"So that gave Olin pause. But still, night after night, he and John found themselves talking for hours on the phone. They were getting close."
63,OLIN LONG,"We got on well. He was somebody that I could—there was intimacy there. And I'm going to tell you the definition of intimacy that was given to me by a counselor. Intimacy is the feeling that I can tell another person my thoughts and my behaviors without fear of judgment. If I can tell them the things that I've done, even things that I'm not proud of, and they're still going to answer the phone and say hey, Olin, how are you getting along. That's how John would do—say, how are you getting along? So we did have a close friendship there."
64,BRIAN REED,"As Olin and John got to know each other, they did what you do—talk about past relationships. And there they had a lot in common. They'd both dealt with a lot of secrecy and repression."
65,OLIN LONG,He told me that he'd had a relationship at one point with an older man. He called him William.
66,BRIAN REED,"This was John's first relationship, according to Olin. He says John was probably 21 when he met this man he called William, which would have been in the late '80s. John told him it was a hot summer's day."
67,OLIN LONG,"And there was a road crew working on the highway right out there in front of John's house. And John said he went out there with some water, kind of like the water boy at a football game. And William was one of the guys out there working on that road crew. And as John said later, William said, the first time I saw you, I knew you were hiding something, that you needed help."
68,BRIAN REED,"Help coming out of the closet, if not to the world, then at least to one other person in the world, which, as far as Olin knows, at that point John had never done. Olin also had an older, more experienced, but still not publicly out man coax him out of the closet and teach him the ropes of gay life as he knew it. His was a professor at his college, a married professor. John's was a tattooed road crew worker in Bibb County."
69,OLIN LONG,"According to John, I don't think anyone else down there knew. William was not obviously gay, no effeminate mannerisms at all. I also know that he was not very literate. It was like a symbiotic relationship. He had something to offer to John, something to help John come out of his isolation. But at the same time, if he got letters in the mail that looked official, and he couldn't read them well, John would interpret those things for him. John might write his checks for him."
70,BRIAN REED,"And in exchange, William imparted on John knowledge he had. Olin refers to them as lessons about sex. I notice that Olin is rather forthright when talking about sex, but he uses somewhat clinical words to do it. Gay people are homosexual, being gay is your sexual orientation, people sleeping together is—"
71,OLIN LONG,Sexual activity.
72,BRIAN REED,"Or physical contact, or, once in a while, when he lets his hair down a little bit, a sexual interlude. Olin believes John and William were together, engaging in sexual activity in utter secret for at least two years before William moved away, a two-year apprenticeship that William provided to John. Did you get the sense that he taught him at all about how to be a gay person in that area?"
73,OLIN LONG,"I'm glad you asked that. No. I didn't get that impression. I didn't get that impression at all. I think it was mostly sex. I don't know that there was any how do we feel about each other, any discussion of the relationship. I got the impression that William's experience with gay life, even though it may have been extensive, was mostly centered around sexual connections, not relationships."
74,BRIAN REED,"And Olin could relate to that, because his experience with his professor was very similar. At 19, Olin admired the man and was grateful to him. But the man was also cheating on his wife and instead of teaching Olin how to have a healthy, open relationship, gave him lessons on how to cruise for sex in parks at nighttime and in public bathrooms. Another thing Olin and John could relate on—they both came out to their families and weren't accepted. Olin told his mother when he was 26. And after that, he says she never mentioned it again, of her own volition. He's about to turn 60. He has never brought home a partner. Olin says when John tried to come out to his mother years ago, she simply left the room. And they never spoke of it again, either, although Olin says he never heard John use the word gay to describe himself. He always used queer, and told Olin he was, quote, ""only 60% to 70% that way."" John and Olin both kept their sexuality hidden for much of their lives. John talked to Olin and to me about how you had to be very careful about that where he lived. And it seems there were only a handful of people in his life he was out to. Olin says John had a refrain he'd use to describe his life in Bibb County. You just learn to live without, he would say, without sex, love, romance, support, companionship, the touch of another person, a partner. You learn to live without."
75,OLIN LONG,"I'll tell you one of the similarities between me and John is that we can be celibate for long periods of time. And I'll just be honest with you. I didn't mean to get into all of this, but I don't mind telling you. It will soon be six years."
76,BRIAN REED,"So much for romance. There was one time Olin knows about when John did fall in love. About two years into their knowing each other, Olin says there was a period where he stopped hearing from John as often as usual."
77,OLIN LONG,"And I called him one night. And it wasn't long before I could tell that there was something on his mind. And the next thing I knew, he went into tears."
78,BRIAN REED,"John told Olin that he'd recently become friends with a guy in town, and they'd started sleeping with each other and spending a lot of time together. The guy had told John he'd had his eye on him for a while. He had some college, and he seemed to have ambition in his career, which John liked. John was head over heels for the guy. He said to Olin that he'd told the guy he loved him, but that the guy didn't seem to reciprocate it. And now John hadn't seen him in a while, and he was leaving him messages saying I love you, call me sometime, and not getting any calls back."
79,OLIN LONG,"He told me what was going on. And then he burst into tears, and he sobbed. This wasn't just a few tears. It was sobbing. He was in the kitchen. He only had a phone in the kitchen. So he was sobbing in there."
80,BRIAN REED,Had you ever seen him cry?
81,BRIAN REED,More in a minute. [AD]
82,OLIN LONG,"And we were sitting there, and he had made a comment—"
83,BRIAN REED,"Olin and I are sitting with each other the first night we've met, and he's telling me all these memories of John. And it takes hours before I understand for sure whether he and John were ever a couple, if they ever actually tried. I don't ever ask Olin outright, but I don't need to. Because it gradually becomes clear that it never happened for them, and that for Olin his relationship with John still feels unresolved. He's telling me stories, remembering things. And in the course of this, his mind drifts now and again to a few tiny moments way in the past that stayed with him, because in them he and John seemed to acknowledge something that they found very difficult to speak about. Like one time when they were riding in the car together through Bibb County, and John had made some remark about Olin that Olin thought was unfair. And Olin told John as much."
84,OLIN LONG,"And when I finished, he smiled and he laughed. He said, you and I could never live together. He said, I just piss you off too much. And I didn't know what to think of that. We weren't talking about living together."
85,BRIAN REED,"Or another time on the phone, when—"
86,OLIN LONG,"He asked me, as long as we've been talking on the phone, do you still consider yourself searching for a partner?"
87,BRIAN REED,"And Olin thought for a moment and then said, not really, John. He wasn't really talking to anyone else."
88,OLIN LONG,"And there was some silence there, and I said, why do you ask? (FALTERING) I—I—I don't know. I don't know. I think he was trying to express an interest. I think it's—I didn't know—I didn't—I didn't delve any deeper. I didn't delve any deeper."
89,BRIAN REED,"I'm trying to figure out how you feel about this. Like, is this something that you feel is a missed opportunity?"
90,OLIN LONG,"(SIGHING) I'm not really sure. I think we had talked so much, and I wasn't comfortable enough with what I was feeling. I couldn't identify it."
91,BRIAN REED,Because what was so...?
92,OLIN LONG,"There were certain things that I was—that I found it hard to get past, some of his profanity and some of his anger. I was somewhat afraid of his anger. Even though I was wondering what it would be like, I wasn't certain that it was really a good place for me to be. Does that make sense?"
93,BRIAN REED,"Olin and John could get on each other's nerves. If you were feeling sensitive or emotional, John was not necessarily the greatest guy to talk to, and Olin felt he could sometimes just be thoughtless or mean. They once had a huge fight that was actually over Olin's favorite movie."
94,OLIN LONG,"It was 2005, because it would have been before Brokeback Mountain came out."
95,BRIAN REED,And he knows a ton about it.
96,OLIN LONG,The movie was filmed—they wrapped up shooting in August of 2004. It wasn't released until December of 2005. So we've got a year-and-a-half post-production.
97,BRIAN REED,"Olin, how many times have you seen this movie?"
98,OLIN LONG,"I would venture to say probably 50 or more times. When it first came out, I couldn't get enough of it. I watched it about every day."
99,OLIN LONG,"And I got so excited about it, I got on the phone, and I was telling John about it, about the movie. And he was listening and listening, and he wasn't saying very much. And then he started talking and telling me I was making too big of an issue out of this, you're getting too much into it. And one thing I really dislike is when I get excited about something, something that I find important, and I'm trying to make a point, and it gets discounted. So I got really irritated, so we got off the phone. I think I went outside. I know what I did."
